{
  "$schema": "https://json-schema.org/draft/2020-12/schema",
  "title": "WeeklyCreativeDirection",
  "type": "object",
  "required": [
    "week",
    "year",
    "dateRange",
    "creativeDirectionName",
    "oneSentenceConcept",
    "heroConcept",
    "experienceMood",
    "emergingSignals",
    "visualLanguage",
    "interactionLanguage",
    "motionLanguage",
    "storytellingApproach",
    "creativeTechnologyIdeas",
    "typographyDirection",
    "compositionDirection",
    "colorDirection",
    "textureDirection",
    "supportingPageTreatment",
    "avoid"
  ],
  "properties": {
    "week": { "type": "integer" },
    "year": { "type": "integer" },
    "dateRange": { "type": "string" },
    "creativeDirectionName": { "type": "string" },
    "oneSentenceConcept": { "type": "string" },
    "heroConcept": { "type": "string" },
    "experienceMood": { "type": "string" },
    "emergingSignals": { "type": "array", "items": { "type": "string" }, "minItems": 2 },
    "visualLanguage": { "type": "string" },
    "interactionLanguage": { "type": "string" },
    "motionLanguage": { "type": "string" },
    "storytellingApproach": { "type": "string" },
    "creativeTechnologyIdeas": { "type": "array", "items": { "type": "string" } },
    "typographyDirection": { "type": "string" },
    "compositionDirection": { "type": "string" },
    "colorDirection": { "type": "string" },
    "textureDirection": { "type": "string" },
    "supportingPageTreatment": { "type": "string" },
    "avoid": { "type": "array", "items": { "type": "string" }, "minItems": 1 }
  },
  "additionalProperties": false
}
