{
  "week": 38,
  "year": 2026,
  "dateRange": "2026-09-14 — 2026-09-20",
  "creativeDirectionName": "Survey Horizon",
  "oneSentenceConcept": "The hero is a surveyed horizon — typographic bearing on a glacier field, one course-line accent — so the rest of the page can sit as quieter waypoints.",
  "heroConcept": "Asymmetric cinematic composition: overscaled type offset like a heading indicator above a single horizon rule. Cool glacier vapor and polar ink. Scroll advances the survey; objects stay bearings, not 3D vessels or cockpits.",
  "experienceMood": "surveyed, expedition-calm, instrument-clear",
  "emergingSignals": [
    "Expedition as a surveyed luxury course",
    "Vessel and mission objects as chapters — extract the sequence, not the hull",
    "AI infrastructure made tangible without replacing the page",
    "Motion declared in markup, last-frame reduced-motion",
    "Two-color ice / instrument fields after last week's drafting sheet"
  ],
  "visualLanguage": "Cool glacier vapor paper, polar ink, and one deep horizon cyan. Soft instrument radius, a single course-line, typographic bearing as primary texture — surveyed ice, not a zinc drafting sheet or wine chamber.",
  "interactionLanguage": "One survey in the hero; depth-reveal on work teasers as ice layers. Highlight cursor only as a bearing mark. Navigation remains a stable lintel. No hold-to-proceed, no globe, no cockpit HUD.",
  "motionLanguage": "One causal thread: horizon-rule extension on entry. Subtle elsewhere. Instant bearing under prefers-reduced-motion — last-frame composition, not deleted composition.",
  "storytellingApproach": "Hero is the surveyed horizon. Supporting sections inherit as quieter chaptered waypoints. Case-study teasers stay teasers — itinerary as index, not a travel takeover.",
  "creativeTechnologyIdeas": [
    "CSS asymmetric hero and a single horizon rule as DOM-first architecture — no WebGL environment",
    "Scroll-driven rule extension in the hero only; fake depth as offset type, not a canvas",
    "Token-driven motion intensity via interaction-system.json — last-frame reduced-motion, not spectacle"
  ],
  "typographyDirection": "Bold sans display overscaled and offset as a bearing in the hero; comfortable minimal body in supporting bands. Hierarchy as heading indicator — not serif magazine editorial.",
  "compositionDirection": "Asymmetric cinematic hero as the surveyed horizon; supporting sections use airy muted bands. Split-grid and cinematic-band reserved off this week.",
  "colorDirection": "Cool glacier vapor field, polar ink, single deep horizon cyan for the course-line and interactive affordances only.",
  "textureDirection": "Flat ice fills, one horizon rule, tight instrument radius. No grain, glass stacks, rust terracotta, neon product green, or gradient meshes.",
  "supportingPageTreatment": "Calmer elevated cards and muted section bands after the horizon. Accent only on interactive affordances. Navigation stays structurally flat and stable.",
  "avoid": [
    "Full WebGL globes, vessel heroes, and education games",
    "Hold-to-proceed, page-unlock, and shader-toy interactions",
    "Thermal / lidar cockpit boot sequences and dark-UI HUDs",
    "Indigo / yellow chroma and idle 3D portfolio spectacle",
    "Olive-warm WebGL travel and sound-required journeys",
    "Walkman cassette navigation and 90s nostalgia as the weekly mood",
    "Zinc drafting paper, split-grid, and blueprint navy from last week",
    "Warm cream editorial palettes and serif magazine layouts",
    "Wine-ink cinematic chambers and instrument-steel sapphire",
    "Snap-sections paired with expressive motion"
  ]
}
